{
  "boundary_id": "fixture.rust_importer.c_unsafe_call.boundary.unsafe_ping",
  "kind": "opaque_call",
  "signature": "opaque.call unsafe_ping() -> int !opaque,unsafe",
  "effects": [
    "opaque",
    "unsafe"
  ],
  "ownership_transfer": {
    "inbound": [],
    "outbound": [
      "int"
    ]
  },
  "capabilities": [
    "capability:unsafe_ping"
  ],
  "determinism": "unknown",
  "audit_note": "unsafe_ping is treated as an explicit Tier C unsafe boundary with capability accounting rather than modeled Rust semantics in the importer-first slice."
}
